Pin_title,Pin_description,Website_link,Media_url,Board_id,Alt_text
25 Passive Income Ideas to Build Financial Freedom Faster,"Discover smart ways to earn extra income with these 25 passive income ideas. If youre dreaming of financial freedom, these investment ideas and money tips make it easier to starteven for beginners looking for simple online business options.",https://gatheringdreams.com/passive-income-ideas-pin/,https://danielepemy.github.io/GDautoTW/images/passive-income-1.jpg,681873268521137033,"Woman looking at the horizon, free from every worry."
25 Ideas That Helped Me Start Earning Passive Income,"I started exploring passive income ideas for beginners, and these 25 options truly changed how I view money. From investment ideas to small business ideas, each one helped me step closer to a rich life and financial freedom.",https://gatheringdreams.com/passive-income-ideas-pin/,https://danielepemy.github.io/GDautoTW/images/passive-income-2.jpg,681873268521137035,"Woman looking at the horizon, free from every worry."
25 Easy Passive Income Ideas Anyone Can Start Today,"Looking to make money with little time? These 25 passive income ideas blend online business tips, investment ideas, and simple ways to earn from home. Perfect for beginners wanting realistic money tips for financial freedom.",https://gatheringdreams.com/passive-income-ideas-pin/,https://danielepemy.github.io/GDautoTW/images/passive-income-3.jpg,681873268520762799,"Woman looking at the horizon, free from every worry."
The 25 Passive Income Ideas That Changed My Money Mindset,"When I first wanted more financial freedom, I tried these 25 passive income ideas. They opened my eyes to new investment ideas, work-from-home options, and ways to build a richer, more flexible life with steady extra income.",https://gatheringdreams.com/passive-income-ideas-pin/,https://danielepemy.github.io/GDautoTW/images/passive-income-4.jpg,681873268520672111,"Woman looking at the horizon, free from every worry."
25 Smart Passive Income Ideas for Beginners on a Budget,"Ready to make money without overwhelm? These 25 passive income ideas for beginners combine practical investment ideas, small business ideas, and simple online business strategies to help you build financial freedom step by step.",https://gatheringdreams.com/passive-income-ideas-pin/,https://danielepemy.github.io/GDautoTW/images/passive-income-5.jpg,681873268520907052,"Woman looking at the horizon, free from every worry."
