Pin_title,Pin_description,Website_link,Media_url,Board_id,Alt_text
25 Meal Prep Recipes for Weight Loss Made Simple,"These easy meal prep ideas keep weekdays calm and cravings quieter. Think healthy meal prep ideas that feel satisfying, with smart portions for healthy weight loss—so lunch meal prep and dinner meal prep stay consistent without feeling restrictive.",https://gatheringdreams.com/25-easy-meal-prep-recipes-for-weight-loss/,https://danielepemy.github.io/GDautoTW/images/meal-prep-for-weight-loss-4_001.jpg,681873268520622952,collage of healthy meal prep recipes for weight loss
25 Meal Prep Recipes for Weight Loss I Rely On,"I lean on these meal prep recipes when my schedule is packed. They’re easy healthy meal prep that holds up for meal prep for work, with non boring healthy meals that still fit my healthy meals for losing weight routine.",https://gatheringdreams.com/25-easy-meal-prep-recipes-for-weight-loss/,https://danielepemy.github.io/GDautoTW/images/meal-prep-for-weight-loss-4_002.jpg,681873268520641415,collage of healthy meal prep recipes for weight loss
25 Meal Prep Recipes for Weight Loss for Busy Weeks,"Busy weeks feel lighter with healthy dinner ideas already planned. This mix of meal prep for dinner and healthy lunch meal prep keeps choices simple, supporting easy meals for weight loss while still tasting like real food.",https://gatheringdreams.com/25-easy-meal-prep-recipes-for-weight-loss/,https://danielepemy.github.io/GDautoTW/images/meal-prep-for-weight-loss-4_003.jpg,681873268520652475,collage of healthy meal prep recipes for weight loss
25 Meal Prep Recipes for Weight Loss My Easy Picks,"I like having dinner meal prep ready so I don’t overthink meals at night. These easy losing weight recipes make meal prep for beginners feel doable, with healthy meal prep ideas that don’t get old midweek.",https://gatheringdreams.com/25-easy-meal-prep-recipes-for-weight-loss/,https://danielepemy.github.io/GDautoTW/images/meal-prep-for-weight-loss-4_004.jpg,681873268521166186,collage of healthy meal prep recipes for weight loss
25 Meal Prep Recipes for Weight Loss That Taste Great,"Flavor matters when you’re staying consistent. These meal prep recipes focus on non boring healthy meals, with healthy meals for losing weight that work as lunch meal prep or meal prep for dinner without feeling repetitive.",https://gatheringdreams.com/25-easy-meal-prep-recipes-for-weight-loss/,https://danielepemy.github.io/GDautoTW/images/meal-prep-for-weight-loss-4_005.jpg,681873268520622949,collage of healthy meal prep recipes for weight loss
25 Meal Prep Recipes for Weight Loss I Actually Enjoy,"I used to think healthy weight loss meals were bland, but this list changed that. It’s easy healthy meal prep with healthy dinner ideas that double as meal prep for work, so my week feels smoother.",https://gatheringdreams.com/25-easy-meal-prep-recipes-for-weight-loss/,https://danielepemy.github.io/GDautoTW/images/meal-prep-for-weight-loss-4_006.jpg,681873268520622951,collage of healthy meal prep recipes for weight loss
25 Meal Prep Recipes for Weight Loss for Beginners Too,"If planning meals feels overwhelming, these easy meal prep ideas simplify it. Expect meal prep for beginners favorites, plus healthy lunch meal prep and losing weight dinner ideas that keep portions steady without sacrificing comfort.",https://gatheringdreams.com/25-easy-meal-prep-recipes-for-weight-loss/,https://danielepemy.github.io/GDautoTW/images/meal-prep-for-weight-loss-4_007.jpg,681873268520985783,collage of healthy meal prep recipes for weight loss
25 Meal Prep Recipes for Weight Loss I Pack for Work,"I pack these healthy lunch meal prep options when I want fewer decisions at noon. They’re meal prep for work friendly, easy meals for weight loss, and the kind of non boring healthy meals I’m happy to repeat.",https://gatheringdreams.com/25-easy-meal-prep-recipes-for-weight-loss/,https://danielepemy.github.io/GDautoTW/images/meal-prep-for-weight-loss-4_008.jpg,681873268520732413,collage of healthy meal prep recipes for weight loss
25 Meal Prep Recipes for Weight Loss That Feel Cozy,"Weight loss can still feel comforting. These healthy dinner ideas lean into satisfying flavors, with dinner meal prep that supports healthy meals for losing weight—great when you want easy healthy meal prep without a “diet” vibe.",https://gatheringdreams.com/25-easy-meal-prep-recipes-for-weight-loss/,https://danielepemy.github.io/GDautoTW/images/meal-prep-for-weight-loss-4_009.jpg,681873268520622952,collage of healthy meal prep recipes for weight loss
25 Meal Prep Recipes for Weight Loss I Make on Repeat,"I rotate these meal prep recipes to keep my week interesting. With easy meal prep ideas for lunch meal prep and meal prep for dinner, it’s simpler to stick with healthy weight loss without getting bored.",https://gatheringdreams.com/25-easy-meal-prep-recipes-for-weight-loss/,https://danielepemy.github.io/GDautoTW/images/meal-prep-for-weight-loss-4_010.jpg,681873268520641415,collage of healthy meal prep recipes for weight loss
25 Meal Prep Recipes for Weight Loss Without Boredom,"The best plans are the ones you’ll actually follow. These non boring healthy meals make healthy meal prep ideas feel fresh, balancing healthy lunch meal prep and losing weight dinner ideas for a steady, realistic rhythm.",https://gatheringdreams.com/25-easy-meal-prep-recipes-for-weight-loss/,https://danielepemy.github.io/GDautoTW/images/meal-prep-for-weight-loss-4_011.jpg,681873268520652475,collage of healthy meal prep recipes for weight loss
25 Meal Prep Recipes for Weight Loss I Swear By,"I keep coming back to these easy healthy meal prep staples when motivation is low. They’re solid meal prep for beginners options, with healthy meals for losing weight that work as dinner for losing weight or lunch meal prep.",https://gatheringdreams.com/25-easy-meal-prep-recipes-for-weight-loss/,https://danielepemy.github.io/GDautoTW/images/meal-prep-for-weight-loss-4_012.jpg,681873268521166186,collage of healthy meal prep recipes for weight loss
25 Meal Prep Recipes for Weight Loss for Real Life,"Real life gets busy, so meals need to be simple. This set of meal prep recipes includes easy meal prep ideas and healthy dinner ideas that fit meal prep for work, helping you stay consistent with healthy weight loss.",https://gatheringdreams.com/25-easy-meal-prep-recipes-for-weight-loss/,https://danielepemy.github.io/GDautoTW/images/meal-prep-for-weight-loss-4_013.jpg,681873268520622949,collage of healthy meal prep recipes for weight loss
25 Meal Prep Recipes for Weight Loss My Weeknight Plan,"My weeknights feel calmer when dinner meal prep is already handled. I use these healthy meal prep ideas as meal prep for dinner, and they double as easy meals for weight loss when I need quick, steady choices.",https://gatheringdreams.com/25-easy-meal-prep-recipes-for-weight-loss/,https://danielepemy.github.io/GDautoTW/images/meal-prep-for-weight-loss-4_014.jpg,681873268520622951,collage of healthy meal prep recipes for weight loss
25 Meal Prep Recipes for Weight Loss That Stay Filling,"Staying full makes everything easier. These easy losing weight recipes focus on balanced portions and satisfying flavors, with healthy lunch meal prep and losing weight dinner ideas that support healthy meals for losing weight all week.",https://gatheringdreams.com/25-easy-meal-prep-recipes-for-weight-loss/,https://danielepemy.github.io/GDautoTW/images/meal-prep-for-weight-loss-4_015.jpg,681873268520985783,collage of healthy meal prep recipes for weight loss
25 Meal Prep Recipes for Weight Loss I Prep When Busy,"When I’m stretched thin, I lean on meal prep for work lunches and simple dinner meal prep. This list nails easy healthy meal prep, with non boring healthy meals that help me stay on track with healthy weight loss.",https://gatheringdreams.com/25-easy-meal-prep-recipes-for-weight-loss/,https://danielepemy.github.io/GDautoTW/images/meal-prep-for-weight-loss-4_016.jpg,681873268520732413,collage of healthy meal prep recipes for weight loss
25 Meal Prep Recipes for Weight Loss for Easy Lunches,"Make lunches feel effortless with healthy lunch meal prep that lasts. These meal prep recipes include easy meal prep ideas that travel well, helping keep easy meals for weight loss consistent even on your busiest workdays.",https://gatheringdreams.com/25-easy-meal-prep-recipes-for-weight-loss/,https://danielepemy.github.io/GDautoTW/images/meal-prep-for-weight-loss-4_017.jpg,681873268520622952,collage of healthy meal prep recipes for weight loss
25 Meal Prep Recipes for Weight Loss I Pack at Noon,"I love opening my lunch and actually feeling excited. These lunch meal prep favorites are easy healthy meal prep, built for meal prep for work, and they fit my healthy meals for losing weight goals without feeling like “diet food.”",https://gatheringdreams.com/25-easy-meal-prep-recipes-for-weight-loss/,https://danielepemy.github.io/GDautoTW/images/meal-prep-for-weight-loss-4_018.jpg,681873268520641415,collage of healthy meal prep recipes for weight loss
25 Meal Prep Recipes for Weight Loss for Simple Dinners,"Dinners get easier when you plan ahead. These healthy dinner ideas work as meal prep for dinner, with dinner meal prep that supports losing weight dinner ideas while keeping flavors bold and non boring healthy meals in rotation.",https://gatheringdreams.com/25-easy-meal-prep-recipes-for-weight-loss/,https://danielepemy.github.io/GDautoTW/images/meal-prep-for-weight-loss-4_019.jpg,681873268520652475,collage of healthy meal prep recipes for weight loss
25 Meal Prep Recipes for Weight Loss I Use Weekly,"I like having a small lineup I can count on. These meal prep recipes make easy meal prep ideas feel automatic, from healthy lunch meal prep to dinner for losing weight, so my week stays steady without extra stress.",https://gatheringdreams.com/25-easy-meal-prep-recipes-for-weight-loss/,https://danielepemy.github.io/GDautoTW/images/meal-prep-for-weight-loss-4_020.jpg,681873268521166186,collage of healthy meal prep recipes for weight loss
25 Meal Prep Recipes for Weight Loss with Big Flavor,"Big flavor keeps habits sticking around. These non boring healthy meals turn healthy meal prep ideas into something you look forward to, balancing lunch meal prep and meal prep for dinner for healthy weight loss that feels sustainable.",https://gatheringdreams.com/25-easy-meal-prep-recipes-for-weight-loss/,https://danielepemy.github.io/GDautoTW/images/meal-prep-for-weight-loss-4_021.jpg,681873268520622949,collage of healthy meal prep recipes for weight loss
25 Meal Prep Recipes for Weight Loss I Keep Handy,"I keep these easy meal prep ideas bookmarked for the weeks I need structure. They’re easy healthy meal prep for meal prep for beginners, with healthy dinner ideas that also work as meal prep for work lunches.",https://gatheringdreams.com/25-easy-meal-prep-recipes-for-weight-loss/,https://danielepemy.github.io/GDautoTW/images/meal-prep-for-weight-loss-4_022.jpg,681873268520622951,collage of healthy meal prep recipes for weight loss
25 Meal Prep Recipes for Weight Loss for Workdays,"Workdays are smoother when meals are ready to grab. These meal prep for work options include healthy lunch meal prep and dinner meal prep, keeping easy meals for weight loss consistent while still feeling satisfying and varied.",https://gatheringdreams.com/25-easy-meal-prep-recipes-for-weight-loss/,https://danielepemy.github.io/GDautoTW/images/meal-prep-for-weight-loss-4_023.jpg,681873268520985783,collage of healthy meal prep recipes for weight loss
25 Meal Prep Recipes for Weight Loss I Meal Prep Fast,"I don’t want complicated plans, just reliable food. This list helps me keep easy healthy meal prep going with lunch meal prep and meal prep for dinner, plus non boring healthy meals that make healthy weight loss feel easier.",https://gatheringdreams.com/25-easy-meal-prep-recipes-for-weight-loss/,https://danielepemy.github.io/GDautoTW/images/meal-prep-for-weight-loss-4_024.jpg,681873268520732413,collage of healthy meal prep recipes for weight loss
25 Meal Prep Recipes for Weight Loss That Feel Fresh,"Fresh ideas prevent the midweek slump. These healthy meal prep ideas include meal prep recipes that work for healthy lunch meal prep and losing weight dinner ideas, so you can keep healthy meals for losing weight feeling enjoyable.",https://gatheringdreams.com/25-easy-meal-prep-recipes-for-weight-loss/,https://danielepemy.github.io/GDautoTW/images/meal-prep-for-weight-loss-5_001.jpg,681873268520622952,collage of healthy meal prep recipes for weight loss
25 Meal Prep Recipes for Weight Loss I Love for Lunch,"I’ve found lunch meal prep is the easiest habit to keep. These meal prep for work friendly options are easy losing weight recipes, and they’re non boring healthy meals that help me stick with healthy weight loss without overthinking.",https://gatheringdreams.com/25-easy-meal-prep-recipes-for-weight-loss/,https://danielepemy.github.io/GDautoTW/images/meal-prep-for-weight-loss-5_002.jpg,681873268520641415,collage of healthy meal prep recipes for weight loss
25 Meal Prep Recipes for Weight Loss That Feel Balanced,"Balance beats perfection. These meal prep recipes focus on easy meal prep ideas and healthy dinner ideas that work for meal prep for beginners, keeping healthy meals for losing weight steady without making meals feel overly strict.",https://gatheringdreams.com/25-easy-meal-prep-recipes-for-weight-loss/,https://danielepemy.github.io/GDautoTW/images/meal-prep-for-weight-loss-5_003.jpg,681873268520652475,collage of healthy meal prep recipes for weight loss
25 Meal Prep Recipes for Weight Loss I Eat After Work,"After work, I want dinner meal prep that’s already decided. These healthy dinner ideas fit my dinner for losing weight goals, and they’re easy healthy meal prep that keeps my evenings relaxed and my choices consistent.",https://gatheringdreams.com/25-easy-meal-prep-recipes-for-weight-loss/,https://danielepemy.github.io/GDautoTW/images/meal-prep-for-weight-loss-5_004.jpg,681873268521166186,collage of healthy meal prep recipes for weight loss
25 Meal Prep Recipes for Weight Loss for Easy Planning,"Planning gets simpler with a solid list you can rotate. These easy meal prep ideas include healthy lunch meal prep and meal prep for dinner, making healthy weight loss feel more like a routine and less like a daily decision.",https://gatheringdreams.com/25-easy-meal-prep-recipes-for-weight-loss/,https://danielepemy.github.io/GDautoTW/images/meal-prep-for-weight-loss-5_005.jpg,681873268520622949,collage of healthy meal prep recipes for weight loss
25 Meal Prep Recipes for Weight Loss I Prep on Sundays,"I like setting myself up early, so weekdays run smoother. These meal prep recipes make easy healthy meal prep doable, with meal prep for work lunches and losing weight dinner ideas that keep me consistent without feeling bored.",https://gatheringdreams.com/25-easy-meal-prep-recipes-for-weight-loss/,https://danielepemy.github.io/GDautoTW/images/meal-prep-for-weight-loss-5_006.jpg,681873268520622951,collage of healthy meal prep recipes for weight loss
25 Meal Prep Recipes for Weight Loss That Keep You Full,"Feeling satisfied helps the plan last. These healthy meals for losing weight include dinner meal prep and healthy lunch meal prep, designed as easy meals for weight loss that stay enjoyable even when you’re repeating meals during the week.",https://gatheringdreams.com/25-easy-meal-prep-recipes-for-weight-loss/,https://danielepemy.github.io/GDautoTW/images/meal-prep-for-weight-loss-5_007.jpg,681873268520985783,collage of healthy meal prep recipes for weight loss
25 Meal Prep Recipes for Weight Loss I Rotate Often,"I rotate these non boring healthy meals so I don’t get stuck in a rut. They’re healthy meal prep ideas that work as meal prep for dinner or lunch meal prep, and they support healthy weight loss without feeling repetitive.",https://gatheringdreams.com/25-easy-meal-prep-recipes-for-weight-loss/,https://danielepemy.github.io/GDautoTW/images/meal-prep-for-weight-loss-5_008.jpg,681873268520732413,collage of healthy meal prep recipes for weight loss
25 Meal Prep Recipes for Weight Loss for Better Lunches,"Better lunches make afternoons easier. These healthy lunch meal prep options are meal prep for work friendly and built around easy meal prep ideas, helping keep healthy meals for losing weight consistent while still tasting fresh and satisfying.",https://gatheringdreams.com/25-easy-meal-prep-recipes-for-weight-loss/,https://danielepemy.github.io/GDautoTW/images/meal-prep-for-weight-loss-5_009.jpg,681873268520622952,collage of healthy meal prep recipes for weight loss
25 Meal Prep Recipes for Weight Loss I Can Stick With,"I’m more consistent when food is simple and ready. These easy meal prep ideas support meal prep for beginners, with healthy dinner ideas and lunch meal prep that feel like non boring healthy meals—so healthy weight loss feels realistic.",https://gatheringdreams.com/25-easy-meal-prep-recipes-for-weight-loss/,https://danielepemy.github.io/GDautoTW/images/meal-prep-for-weight-loss-5_010.jpg,681873268520641415,collage of healthy meal prep recipes for weight loss
25 Meal Prep Recipes for Weight Loss That Feel Satisfying,"Satisfying meals are what keep momentum going. These meal prep recipes include healthy dinner ideas and healthy lunch meal prep, built as easy losing weight recipes that don’t feel tiny or bland, just balanced and doable.",https://gatheringdreams.com/25-easy-meal-prep-recipes-for-weight-loss/,https://danielepemy.github.io/GDautoTW/images/meal-prep-for-weight-loss-5_011.jpg,681873268520652475,collage of healthy meal prep recipes for weight loss
25 Meal Prep Recipes for Weight Loss I Love for Dinner,"Dinner is where my plan used to fall apart. These dinner meal prep ideas make meal prep for dinner easy, with healthy meals for losing weight that feel comforting and non boring healthy meals I’m genuinely happy to eat.",https://gatheringdreams.com/25-easy-meal-prep-recipes-for-weight-loss/,https://danielepemy.github.io/GDautoTW/images/meal-prep-for-weight-loss-5_012.jpg,681873268521166186,collage of healthy meal prep recipes for weight loss
25 Meal Prep Recipes for Weight Loss for Less Stress,"Less stress starts with fewer food decisions. These easy meal prep ideas cover lunch meal prep and meal prep for dinner, making healthy weight loss feel steady, with healthy meal prep ideas that fit busy schedules and real appetites.",https://gatheringdreams.com/25-easy-meal-prep-recipes-for-weight-loss/,https://danielepemy.github.io/GDautoTW/images/meal-prep-for-weight-loss-5_013.jpg,681873268520622949,collage of healthy meal prep recipes for weight loss
25 Meal Prep Recipes for Weight Loss I Grab on Busy Days,"On my busiest days, I’m grateful for meal prep for work lunches already packed. These easy healthy meal prep options are healthy meals for losing weight that still feel flavorful—exactly the kind of non boring healthy meals I need.",https://gatheringdreams.com/25-easy-meal-prep-recipes-for-weight-loss/,https://danielepemy.github.io/GDautoTW/images/meal-prep-for-weight-loss-5_014.jpg,681873268520622951,collage of healthy meal prep recipes for weight loss
25 Meal Prep Recipes for Weight Loss That Don’t Feel Strict,"Weight loss doesn’t have to feel intense. These meal prep recipes focus on healthy dinner ideas and healthy lunch meal prep, keeping easy meals for weight loss approachable while still supporting healthy meals for losing weight day after day.",https://gatheringdreams.com/25-easy-meal-prep-recipes-for-weight-loss/,https://danielepemy.github.io/GDautoTW/images/meal-prep-for-weight-loss-5_015.jpg,681873268520985783,collage of healthy meal prep recipes for weight loss
25 Meal Prep Recipes for Weight Loss I Wish I Knew,"I wish I had this list when I started meal prep for beginners. It’s packed with easy meal prep ideas, meal prep for dinner, and healthy lunch meal prep—plus non boring healthy meals that make healthy weight loss feel less frustrating.",https://gatheringdreams.com/25-easy-meal-prep-recipes-for-weight-loss/,https://danielepemy.github.io/GDautoTW/images/meal-prep-for-weight-loss-5_016.jpg,681873268520732413,collage of healthy meal prep recipes for weight loss
25 Meal Prep Recipes for Weight Loss for Better Evenings,"Evenings run smoother when dinner is planned. These losing weight dinner ideas pair well with dinner meal prep routines, giving you easy healthy meal prep that supports healthy weight loss while still feeling satisfying and flavorful.",https://gatheringdreams.com/25-easy-meal-prep-recipes-for-weight-loss/,https://danielepemy.github.io/GDautoTW/images/meal-prep-for-weight-loss-5_017.jpg,681873268520622952,collage of healthy meal prep recipes for weight loss
25 Meal Prep Recipes for Weight Loss I Keep in Rotation,"I keep these meal prep recipes in rotation because they’re simple and reliable. With meal prep for work lunches and meal prep for dinner, it’s easy losing weight recipes that help me stay consistent and avoid boring repeats.",https://gatheringdreams.com/25-easy-meal-prep-recipes-for-weight-loss/,https://danielepemy.github.io/GDautoTW/images/meal-prep-for-weight-loss-5_018.jpg,681873268520641415,collage of healthy meal prep recipes for weight loss
25 Meal Prep Recipes for Weight Loss That Feel Light,"When you want lighter meals that still satisfy, this list helps. Expect healthy meal prep ideas that work for healthy lunch meal prep and dinner for losing weight, with easy meal prep ideas that support a steady healthy weight loss routine.",https://gatheringdreams.com/25-easy-meal-prep-recipes-for-weight-loss/,https://danielepemy.github.io/GDautoTW/images/meal-prep-for-weight-loss-5_019.jpg,681873268520652475,collage of healthy meal prep recipes for weight loss
25 Meal Prep Recipes for Weight Loss I Pack Every Week,"I pack these lunch meal prep options almost every week because they stay enjoyable. They’re meal prep for work friendly, easy healthy meal prep, and they fit my healthy meals for losing weight goals without feeling like a sacrifice.",https://gatheringdreams.com/25-easy-meal-prep-recipes-for-weight-loss/,https://danielepemy.github.io/GDautoTW/images/meal-prep-for-weight-loss-5_020.jpg,681873268521166186,collage of healthy meal prep recipes for weight loss
25 Meal Prep Recipes for Weight Loss with Easy Variety,"Variety keeps meal prep from feeling repetitive. These meal prep recipes offer non boring healthy meals that work as healthy lunch meal prep or meal prep for dinner, making easy meals for weight loss feel more enjoyable throughout the week.",https://gatheringdreams.com/25-easy-meal-prep-recipes-for-weight-loss/,https://danielepemy.github.io/GDautoTW/images/meal-prep-for-weight-loss-5_021.jpg,681873268520622949,collage of healthy meal prep recipes for weight loss
25 Meal Prep Recipes for Weight Loss I Make When Tired,"When I’m tired, I don’t want complicated steps—just food that’s ready. These easy meal prep ideas make easy healthy meal prep possible, with healthy dinner ideas and meal prep for work lunches that keep me consistent.",https://gatheringdreams.com/25-easy-meal-prep-recipes-for-weight-loss/,https://danielepemy.github.io/GDautoTW/images/meal-prep-for-weight-loss-5_022.jpg,681873268520622951,collage of healthy meal prep recipes for weight loss
25 Meal Prep Recipes for Weight Loss That Save Decisions,"Fewer decisions means more follow-through. These healthy meal prep ideas cover lunch meal prep and dinner meal prep, offering easy losing weight recipes that make healthy meals for losing weight feel routine, not like a constant challenge.",https://gatheringdreams.com/25-easy-meal-prep-recipes-for-weight-loss/,https://danielepemy.github.io/GDautoTW/images/meal-prep-for-weight-loss-5_023.jpg,681873268520985783,collage of healthy meal prep recipes for weight loss
25 Meal Prep Recipes for Weight Loss I Use for Balance,"I use these meal prep recipes when I want balance, not extremes. They’re healthy dinner ideas and healthy lunch meal prep that feel like non boring healthy meals, helping me keep healthy weight loss steady without obsessing.",https://gatheringdreams.com/25-easy-meal-prep-recipes-for-weight-loss/,https://danielepemy.github.io/GDautoTW/images/meal-prep-for-weight-loss-5_024.jpg,681873268520732413,collage of healthy meal prep recipes for weight loss
25 Meal Prep Recipes for Weight Loss for Happy Lunches,"Lunch can be something you look forward to. These healthy lunch meal prep favorites are easy meal prep ideas for meal prep for work, built as easy meals for weight loss that still feel satisfying, fresh, and far from boring.",https://gatheringdreams.com/25-easy-meal-prep-recipes-for-weight-loss/,https://danielepemy.github.io/GDautoTW/images/meal-prep-for-weight-loss-6_001.jpg,681873268520622952,collage of healthy meal prep recipes for weight loss
25 Meal Prep Recipes for Weight Loss I Count On Daily,"I count on these easy meal prep ideas when my routine gets chaotic. They’re meal prep for beginners friendly, with dinner meal prep and lunch meal prep options that make healthy meals for losing weight feel simple and repeatable.",https://gatheringdreams.com/25-easy-meal-prep-recipes-for-weight-loss/,https://danielepemy.github.io/GDautoTW/images/meal-prep-for-weight-loss-6_002.jpg,681873268520641415,collage of healthy meal prep recipes for weight loss
