Pin_title,Pin_description,Website_link,Media_url,Board_id,Alt_text
25 Meal Prep Recipes for Weight Loss That Feel Comforting,"Comfort food can still fit your goals. These healthy dinner ideas are great for meal prep for dinner, with easy healthy meal prep that supports healthy weight loss and keeps non boring healthy meals in your weekly lineup.",https://gatheringdreams.com/25-easy-meal-prep-recipes-for-weight-loss/,https://danielepemy.github.io/GDautoTW/images/meal-prep-for-weight-loss-6_003.jpg,681873268520652475,collage of healthy meal prep recipes for weight loss
25 Meal Prep Recipes for Weight Loss I Keep for Weeknights,"I keep these losing weight dinner ideas handy for weeknights when I’m tempted to wing it. With dinner meal prep and easy losing weight recipes, it’s easier to stay consistent and still enjoy non boring healthy meals.",https://gatheringdreams.com/25-easy-meal-prep-recipes-for-weight-loss/,https://danielepemy.github.io/GDautoTW/images/meal-prep-for-weight-loss-6_004.jpg,681873268521166186,collage of healthy meal prep recipes for weight loss
25 Meal Prep Recipes for Weight Loss for Easy Routines,"A simple routine beats a perfect plan. These meal prep recipes include easy meal prep ideas for healthy lunch meal prep and meal prep for dinner, making healthy meals for losing weight feel automatic on busy days.",https://gatheringdreams.com/25-easy-meal-prep-recipes-for-weight-loss/,https://danielepemy.github.io/GDautoTW/images/meal-prep-for-weight-loss-6_005.jpg,681873268520622949,collage of healthy meal prep recipes for weight loss
25 Meal Prep Recipes for Weight Loss I Make for Workdays,"I like having meal prep for work ready so my afternoons don’t derail. These easy healthy meal prep options include lunch meal prep and healthy dinner ideas, giving me healthy meals for losing weight that still taste exciting.",https://gatheringdreams.com/25-easy-meal-prep-recipes-for-weight-loss/,https://danielepemy.github.io/GDautoTW/images/meal-prep-for-weight-loss-6_006.jpg,681873268520622951,collage of healthy meal prep recipes for weight loss
25 Meal Prep Recipes for Weight Loss That Feel Energizing,"Feeling energized starts with consistent meals. These healthy meal prep ideas combine healthy lunch meal prep and dinner meal prep, offering easy meals for weight loss that support healthy weight loss without feeling bland or repetitive.",https://gatheringdreams.com/25-easy-meal-prep-recipes-for-weight-loss/,https://danielepemy.github.io/GDautoTW/images/meal-prep-for-weight-loss-6_007.jpg,681873268520985783,collage of healthy meal prep recipes for weight loss
25 Meal Prep Recipes for Weight Loss I Share with Friends,"I share these easy meal prep ideas because they make healthy meal prep feel approachable. With meal prep for beginners favorites and healthy dinner ideas, it’s easier to build healthy meals for losing weight that don’t feel boring.",https://gatheringdreams.com/25-easy-meal-prep-recipes-for-weight-loss/,https://danielepemy.github.io/GDautoTW/images/meal-prep-for-weight-loss-6_008.jpg,681873268520732413,collage of healthy meal prep recipes for weight loss
25 Meal Prep Recipes for Weight Loss for Easy Wins,"Small wins add up. These easy losing weight recipes make meal prep for work and lunch meal prep simple, while keeping healthy dinner ideas ready too—so healthy meals for losing weight feel doable even during hectic weeks.",https://gatheringdreams.com/25-easy-meal-prep-recipes-for-weight-loss/,https://danielepemy.github.io/GDautoTW/images/meal-prep-for-weight-loss-6_009.jpg,681873268520622952,collage of healthy meal prep recipes for weight loss
25 Meal Prep Recipes for Weight Loss I Keep for Variety,"I keep these meal prep recipes around for days I crave variety. They’re non boring healthy meals that work for meal prep for dinner and healthy lunch meal prep, helping me stay consistent with easy meals for weight loss.",https://gatheringdreams.com/25-easy-meal-prep-recipes-for-weight-loss/,https://danielepemy.github.io/GDautoTW/images/meal-prep-for-weight-loss-6_010.jpg,681873268520641415,collage of healthy meal prep recipes for weight loss
25 Meal Prep Recipes for Weight Loss with Healthy Staples,"Healthy staples make meal prep predictable in the best way. This list of meal prep recipes supports healthy lunch meal prep and dinner meal prep, offering easy healthy meal prep that fits healthy weight loss without feeling like a crash plan.",https://gatheringdreams.com/25-easy-meal-prep-recipes-for-weight-loss/,https://danielepemy.github.io/GDautoTW/images/meal-prep-for-weight-loss-6_011.jpg,681873268520652475,collage of healthy meal prep recipes for weight loss
25 Meal Prep Recipes for Weight Loss I Use for Dinners,"I use these healthy dinner ideas when I want dinner for losing weight that still feels satisfying. With meal prep for dinner and easy healthy meal prep built in, it’s easier to stay consistent and avoid last-minute choices.",https://gatheringdreams.com/25-easy-meal-prep-recipes-for-weight-loss/,https://danielepemy.github.io/GDautoTW/images/meal-prep-for-weight-loss-6_012.jpg,681873268521166186,collage of healthy meal prep recipes for weight loss
25 Meal Prep Recipes for Weight Loss That Feel Exciting,"Exciting meals make consistency easier. These non boring healthy meals pair perfectly with lunch meal prep and meal prep for dinner, keeping healthy meals for losing weight enjoyable while you focus on healthy weight loss day by day.",https://gatheringdreams.com/25-easy-meal-prep-recipes-for-weight-loss/,https://danielepemy.github.io/GDautoTW/images/meal-prep-for-weight-loss-6_013.jpg,681873268520622949,collage of healthy meal prep recipes for weight loss
25 Meal Prep Recipes for Weight Loss I Keep in My Notes,"I keep this list in my notes for the weeks I need a reset. It’s full of easy meal prep ideas, meal prep for work lunches, and losing weight dinner ideas that make healthy meals for losing weight feel straightforward.",https://gatheringdreams.com/25-easy-meal-prep-recipes-for-weight-loss/,https://danielepemy.github.io/GDautoTW/images/meal-prep-for-weight-loss-6_014.jpg,681873268520622951,collage of healthy meal prep recipes for weight loss
25 Meal Prep Recipes for Weight Loss for Meal Prep Beginners,"Starting from scratch? These meal prep for beginners ideas make it simpler to plan ahead. You’ll find easy healthy meal prep options for healthy lunch meal prep and dinner meal prep, with flavors that keep non boring healthy meals on repeat.",https://gatheringdreams.com/25-easy-meal-prep-recipes-for-weight-loss/,https://danielepemy.github.io/GDautoTW/images/meal-prep-for-weight-loss-6_015.jpg,681873268520985783,collage of healthy meal prep recipes for weight loss
25 Meal Prep Recipes for Weight Loss I Started With,"I started with simple lunch meal prep and built from there. These easy meal prep ideas include meal prep recipes for healthy dinner ideas too, so healthy weight loss feels more manageable and my meals stay non boring.",https://gatheringdreams.com/25-easy-meal-prep-recipes-for-weight-loss/,https://danielepemy.github.io/GDautoTW/images/meal-prep-for-weight-loss-6_016.jpg,681873268520732413,collage of healthy meal prep recipes for weight loss
25 Meal Prep Recipes for Weight Loss That Work Anywhere,"Meals should fit your life, not the other way around. These meal prep for work friendly options include healthy lunch meal prep and dinner for losing weight, offering easy losing weight recipes that stay practical even on hectic days.",https://gatheringdreams.com/25-easy-meal-prep-recipes-for-weight-loss/,https://danielepemy.github.io/GDautoTW/images/meal-prep-for-weight-loss-6_017.jpg,681873268520622952,collage of healthy meal prep recipes for weight loss
25 Meal Prep Recipes for Weight Loss I Keep for Lunches,"I keep these healthy lunch meal prep options ready so I don’t end up grabbing something random. They’re easy healthy meal prep, built for meal prep for work, and they help me stay consistent with healthy meals for losing weight.",https://gatheringdreams.com/25-easy-meal-prep-recipes-for-weight-loss/,https://danielepemy.github.io/GDautoTW/images/meal-prep-for-weight-loss-6_018.jpg,681873268520641415,collage of healthy meal prep recipes for weight loss
25 Meal Prep Recipes for Weight Loss for Better Habits,"Better habits start with meals you enjoy. These healthy meal prep ideas include meal prep for dinner and lunch meal prep, giving you easy meals for weight loss that feel satisfying, consistent, and far from repetitive.",https://gatheringdreams.com/25-easy-meal-prep-recipes-for-weight-loss/,https://danielepemy.github.io/GDautoTW/images/meal-prep-for-weight-loss-6_019.jpg,681873268520652475,collage of healthy meal prep recipes for weight loss
25 Meal Prep Recipes for Weight Loss I Rely On Often,"I rely on these easy losing weight recipes when I need structure without stress. They’re dinner meal prep and healthy lunch meal prep staples, with non boring healthy meals that make healthy weight loss feel a lot more sustainable.",https://gatheringdreams.com/25-easy-meal-prep-recipes-for-weight-loss/,https://danielepemy.github.io/GDautoTW/images/meal-prep-for-weight-loss-6_020.jpg,681873268521166186,collage of healthy meal prep recipes for weight loss
25 Meal Prep Recipes for Weight Loss with Easy Dinners,"Easy dinners can still support your goals. These losing weight dinner ideas double as meal prep for dinner, with healthy dinner ideas that feel flavorful and filling—perfect for keeping healthy meals for losing weight steady all week.",https://gatheringdreams.com/25-easy-meal-prep-recipes-for-weight-loss/,https://danielepemy.github.io/GDautoTW/images/meal-prep-for-weight-loss-6_021.jpg,681873268520622949,collage of healthy meal prep recipes for weight loss
25 Meal Prep Recipes for Weight Loss I Use to Stay Consistent,"I use these meal prep recipes to stay consistent when motivation comes and goes. With easy meal prep ideas for meal prep for work and dinner meal prep, it’s simpler to keep healthy meals for losing weight without getting bored.",https://gatheringdreams.com/25-easy-meal-prep-recipes-for-weight-loss/,https://danielepemy.github.io/GDautoTW/images/meal-prep-for-weight-loss-6_022.jpg,681873268520622951,collage of healthy meal prep recipes for weight loss
25 Meal Prep Recipes for Weight Loss That Feel Simple,"Simple plans are the easiest to maintain. These healthy meal prep ideas include easy healthy meal prep options for lunch meal prep and meal prep for dinner, helping healthy weight loss feel like a routine rather than a daily struggle.",https://gatheringdreams.com/25-easy-meal-prep-recipes-for-weight-loss/,https://danielepemy.github.io/GDautoTW/images/meal-prep-for-weight-loss-6_023.jpg,681873268520985783,collage of healthy meal prep recipes for weight loss
25 Meal Prep Recipes for Weight Loss I Keep for Weekdays,"I keep these easy meal prep ideas for weekdays when time is tight. They’re meal prep for beginners friendly, with healthy dinner ideas and healthy lunch meal prep that feel like non boring healthy meals—so healthy weight loss stays realistic.",https://gatheringdreams.com/25-easy-meal-prep-recipes-for-weight-loss/,https://danielepemy.github.io/GDautoTW/images/meal-prep-for-weight-loss-6_024.jpg,681873268520732413,collage of healthy meal prep recipes for weight loss
